{
  "contract": "melo.variant-recipe",
  "contractVersion": "1.0.0",
  "id": "variant.copper",
  "masterId": "master.demo",
  "lockMode": "frame-exact",
  "lookPackRef": {
    "id": "look.copper",
    "version": "1.0.0",
    "kind": "look-pack",
    "contentHash": "sha256:d0d0237c9fe4974ad2b07b29d517f8fffabb4f89ad8a3b4c4344d9e2a6e2d7af"
  },
  "seed": 20260902
}
